{
  "format": "tilefoundry.warpgroup_problem.v3",
  "inputs": [
    {
      "id": "%kv",
      "type": "kv_blocks"
    },
    {
      "id": "%q",
      "type": "q_tiles"
    },
    {
      "id": "%validity",
      "type": "validity_blocks"
    }
  ],
  "loop": {
    "index": "%i",
    "iter_args": [
      {
        "id": "%l0",
        "init": 0.0,
        "yield": "%l0_next"
      },
      {
        "id": "%l1",
        "init": 0.0,
        "yield": "%l1_next"
      },
      {
        "id": "%m0_prev",
        "init": -1E+30,
        "yield": "%m0_next"
      },
      {
        "id": "%m1_prev",
        "init": -1E+30,
        "yield": "%m1"
      },
      {
        "id": "%o_left",
        "init": 0.0,
        "yield": "%o_left_next"
      },
      {
        "id": "%o_right",
        "init": 0.0,
        "yield": "%o_right_next"
      }
    ],
    "iterations": 16,
    "ops": [
      {
        "completion_latency": 427,
        "id": "copy_kv0_0",
        "issue_duration": 114,
        "outputs": [
          {
            "expr": [
              "copy",
              [
                "index",
                "%kv",
                "%i",
                0,
                0
              ]
            ],
            "id": "%kv0_0s",
            "type": "kv_tile"
          }
        ],
        "resource_windows": [],
        "warp_group": 2
      },
      {
        "completion_latency": 427,
        "id": "copy_kv0_1",
        "issue_duration": 114,
        "outputs": [
          {
            "expr": [
              "copy",
              [
                "index",
                "%kv",
                "%i",
                0,
                1
              ]
            ],
            "id": "%kv0_1s",
            "type": "kv_tile"
          }
        ],
        "resource_windows": [],
        "warp_group": 2
      },
      {
        "completion_latency": 427,
        "id": "copy_kv0_2",
        "issue_duration": 114,
        "outputs": [
          {
            "expr": [
              "copy",
              [
                "index",
                "%kv",
                "%i",
                0,
                2
              ]
            ],
            "id": "%kv0_2s",
            "type": "kv_tile"
          }
        ],
        "resource_windows": [],
        "warp_group": 2
      },
      {
        "completion_latency": 427,
        "id": "copy_kv0_3",
        "issue_duration": 114,
        "outputs": [
          {
            "expr": [
              "copy",
              [
                "index",
                "%kv",
                "%i",
                0,
                3
              ]
            ],
            "id": "%kv0_3s",
            "type": "kv_tile"
          }
        ],
        "resource_windows": [],
        "warp_group": 2
      },
      {
        "completion_latency": 427,
        "id": "copy_kv0_4",
        "issue_duration": 114,
        "outputs": [
          {
            "expr": [
              "copy",
              [
                "index",
                "%kv",
                "%i",
                0,
                4
              ]
            ],
            "id": "%kv0_4s",
            "type": "kv_tile"
          }
        ],
        "resource_windows": [],
        "warp_group": 2
      },
      {
        "completion_latency": 427,
        "id": "copy_kv0_5",
        "issue_duration": 114,
        "outputs": [
          {
            "expr": [
              "copy",
              [
                "index",
                "%kv",
                "%i",
                0,
                5
              ]
            ],
            "id": "%kv0_5s",
            "type": "kv_tile"
          }
        ],
        "resource_windows": [],
        "warp_group": 2
      },
      {
        "completion_latency": 427,
        "id": "copy_kv0_6",
        "issue_duration": 114,
        "outputs": [
          {
            "expr": [
              "copy",
              [
                "index",
                "%kv",
                "%i",
                0,
                6
              ]
            ],
            "id": "%kv0_6s",
            "type": "kv_tile"
          }
        ],
        "resource_windows": [],
        "warp_group": 2
      },
      {
        "completion_latency": 427,
        "id": "copy_kv0_7",
        "issue_duration": 114,
        "outputs": [
          {
            "expr": [
              "copy",
              [
                "index",
                "%kv",
                "%i",
                0,
                7
              ]
            ],
            "id": "%kv0_7s",
            "type": "kv_tile"
          }
        ],
        "resource_windows": [],
        "warp_group": 2
      },
      {
        "completion_latency": 427,
        "id": "copy_kv0_8",
        "issue_duration": 114,
        "outputs": [
          {
            "expr": [
              "copy",
              [
                "index",
                "%kv",
                "%i",
                0,
                8
              ]
            ],
            "id": "%kv0_8s",
            "type": "kv_tile"
          }
        ],
        "resource_windows": [],
        "warp_group": 2
      },
      {
        "completion_latency": 427,
        "id": "copy_kv1_0",
        "issue_duration": 114,
        "outputs": [
          {
            "expr": [
              "copy",
              [
                "index",
                "%kv",
                "%i",
                1,
                0
              ]
            ],
            "id": "%kv1_0s",
            "type": "kv_tile"
          }
        ],
        "resource_windows": [],
        "warp_group": 2
      },
      {
        "completion_latency": 427,
        "id": "copy_kv1_1",
        "issue_duration": 114,
        "outputs": [
          {
            "expr": [
              "copy",
              [
                "index",
                "%kv",
                "%i",
                1,
                1
              ]
            ],
            "id": "%kv1_1s",
            "type": "kv_tile"
          }
        ],
        "resource_windows": [],
        "warp_group": 2
      },
      {
        "completion_latency": 427,
        "id": "copy_kv1_2",
        "issue_duration": 114,
        "outputs": [
          {
            "expr": [
              "copy",
              [
                "index",
                "%kv",
                "%i",
                1,
                2
              ]
            ],
            "id": "%kv1_2s",
            "type": "kv_tile"
          }
        ],
        "resource_windows": [],
        "warp_group": 2
      },
      {
        "completion_latency": 427,
        "id": "copy_kv1_3",
        "issue_duration": 114,
        "outputs": [
          {
            "expr": [
              "copy",
              [
                "index",
                "%kv",
                "%i",
                1,
                3
              ]
            ],
            "id": "%kv1_3s",
            "type": "kv_tile"
          }
        ],
        "resource_windows": [],
        "warp_group": 2
      },
      {
        "completion_latency": 427,
        "id": "copy_kv1_4",
        "issue_duration": 114,
        "outputs": [
          {
            "expr": [
              "copy",
              [
                "index",
                "%kv",
                "%i",
                1,
                4
              ]
            ],
            "id": "%kv1_4s",
            "type": "kv_tile"
          }
        ],
        "resource_windows": [],
        "warp_group": 2
      },
      {
        "completion_latency": 427,
        "id": "copy_kv1_5",
        "issue_duration": 114,
        "outputs": [
          {
            "expr": [
              "copy",
              [
                "index",
                "%kv",
                "%i",
                1,
                5
              ]
            ],
            "id": "%kv1_5s",
            "type": "kv_tile"
          }
        ],
        "resource_windows": [],
        "warp_group": 2
      },
      {
        "completion_latency": 427,
        "id": "copy_kv1_6",
        "issue_duration": 114,
        "outputs": [
          {
            "expr": [
              "copy",
              [
                "index",
                "%kv",
                "%i",
                1,
                6
              ]
            ],
            "id": "%kv1_6s",
            "type": "kv_tile"
          }
        ],
        "resource_windows": [],
        "warp_group": 2
      },
      {
        "completion_latency": 427,
        "id": "copy_kv1_7",
        "issue_duration": 114,
        "outputs": [
          {
            "expr": [
              "copy",
              [
                "index",
                "%kv",
                "%i",
                1,
                7
              ]
            ],
            "id": "%kv1_7s",
            "type": "kv_tile"
          }
        ],
        "resource_windows": [],
        "warp_group": 2
      },
      {
        "completion_latency": 427,
        "id": "copy_kv1_8",
        "issue_duration": 114,
        "outputs": [
          {
            "expr": [
              "copy",
              [
                "index",
                "%kv",
                "%i",
                1,
                8
              ]
            ],
            "id": "%kv1_8s",
            "type": "kv_tile"
          }
        ],
        "resource_windows": [],
        "warp_group": 2
      },
      {
        "completion_latency": 354,
        "id": "copy_p0_shared",
        "issue_duration": 350,
        "outputs": [
          {
            "expr": [
              "copy",
              "%p0_scaled"
            ],
            "id": "%p0_s",
            "type": "shared_probability"
          }
        ],
        "resource_windows": [],
        "warp_group": 0
      },
      {
        "completion_latency": 354,
        "id": "copy_p1_shared",